<?xml version="1.0" encoding="UTF-8"?>
<!-- <?xml-stylesheet href="yc1.xsl" type="text/xsl"?> -->
<!-- <?xml-stylesheet href="yc2.xsl" type="text/xsl"?> -->
<!-- <?xml-stylesheet href="yc3.xsl" type="text/xsl"?>? -->
<!-- <?xml-stylesheet href="yc4.xsl" type="text/xsl"?> -->
<?xml-stylesheet href="yc5.xsl" type="text/xsl"?>
<Employees xmlns:xsi="http://www.w3.org/2001/XMLSchema-instance" xsi:noNamespaceSchemaLocation="btl.xsd" >
    <Employee>
        <EmployeeId>101</EmployeeId>
        <FirstName>Tô Ngọc</FirstName>
        <LastName>Anh</LastName>
        <Email>ngocanh11@gmail.com</Email>
        <PhoneNumber>0966242899</PhoneNumber>
        <Date>2019-01-15</Date>
        <JobId>11</JobId>
        <Salary>2500</Salary>
        <ManagerId>108</ManagerId>
    </Employee>
    <Employee>
        <EmployeeId>102</EmployeeId>
        <FirstName>Phạm Khải</FirstName>
        <LastName>Hoàn</LastName>
        <Email>hoan15402@gmail.com</Email>
        <PhoneNumber>0967322322</PhoneNumber>
        <Date>2021-03-25</Date>
        <JobId>3</JobId>
        <Salary>2250</Salary>
        <ManagerId>102</ManagerId>
    </Employee>
    <Employee>
        <EmployeeId>103</EmployeeId>
        <FirstName>Dương Long</FirstName>
        <LastName>Đình</LastName>
        <Email>longdinhduong24@gmail.com</Email>
        <PhoneNumber>0386345189</PhoneNumber>
        <Date>2022-01-01</Date>
        <JobId>4</JobId>
        <Salary>1750</Salary>
        <ManagerId>101</ManagerId>
    </Employee>
    <Employee>
        <EmployeeId>104</EmployeeId>
        <FirstName>Hoàng Lan</FirstName>
        <LastName>Hương</LastName>
        <Email>lanhuong231@gmail.com</Email>
        <PhoneNumber>0988678999</PhoneNumber>
        <Date>2021-06-01</Date>
        <JobId>2</JobId>
        <Salary>2400</Salary>
        <ManagerId>109</ManagerId>
    </Employee>
    <Employee>
        <EmployeeId>105</EmployeeId>
        <FirstName>Trần Minh</FirstName>
        <LastName>Chiến</LastName>
        <Email>chientran44@gmail.com</Email>
        <PhoneNumber>0963253647</PhoneNumber>
        <Date>2017-08-01</Date>
        <JobId>1</JobId>
        <Salary>2550</Salary>
        <ManagerId>105</ManagerId>
    </Employee>
    <Employee>
        <EmployeeId>106</EmployeeId>
        <FirstName>Phan Chiến</FirstName>
        <LastName>Thắng</LastName>
        <Email>thang210799@gmail.com</Email>
        <PhoneNumber>0826468231</PhoneNumber>
        <Date>2021-07-18</Date>
        <JobId>2</JobId>
        <Salary>1800</Salary>
        <ManagerId>108</ManagerId>
    </Employee>
    <Employee>
        <EmployeeId>107</EmployeeId>
        <FirstName>Nguyễn Yến</FirstName>
        <LastName>Nhi</LastName>
        <Email>yennhi201@gmail.com</Email>
        <PhoneNumber>0966214953</PhoneNumber>
        <Date>2019-04-01</Date>
        <JobId>15</JobId>
        <Salary>2600</Salary>
        <ManagerId>108</ManagerId>
    </Employee>
    <Employee>
        <EmployeeId>108</EmployeeId>
        <FirstName>Lê Quang</FirstName>
        <LastName>Minh</LastName>
        <Email>lqminh98@gmail.com</Email>
        <PhoneNumber>0962624952</PhoneNumber>
        <Date>2022-01-07</Date>
        <JobId>2</JobId>
        <Salary>1650</Salary>
        <ManagerId>107</ManagerId>
    </Employee>
    <Employee>
        <EmployeeId>109</EmployeeId>
        <FirstName>Ngô Tiến</FirstName>
        <LastName>Đạt</LastName>
        <Email>ngotiendat3103@gmail.com</Email>
        <PhoneNumber>0382624769</PhoneNumber>
        <Date>2016-02-11</Date>
        <JobId>7</JobId>
        <Salary>2950</Salary>
        <ManagerId>108</ManagerId>
    </Employee>
    <Employee>
        <EmployeeId>110</EmployeeId>
        <FirstName>Đỗ Đức</FirstName>
        <LastName>Long</LastName>
        <Email>long14102@gmail.com</Email>
        <PhoneNumber>0388698589</PhoneNumber>
        <Date>2019-07-07</Date>
        <JobId>6</JobId>
        <Salary>2050</Salary>
        <ManagerId>104</ManagerId>
    </Employee>
</Employees>